{
  "event_version": "1.0.0",
  "repository": {
    "owner": "korczis",
    "name": "vomaste.cz",
    "full_name": "korczis/vomaste.cz"
  },
  "issue": {
    "number": 209,
    "title": "[Podnět] Testovací podnět",
    "body": "<!-- vomaste-intake-form:v1 -->\n\n> ⚠️ **Tato issue bude veřejná a dlouhodobě dohledatelná.** Neposílejte neveřejné dokumenty, identitu oznamovatele, osobní kontaktní údaje ani citlivý materiál. Projekt zatím nemá důvěrný intake kanál a smazání z GitHubu obsah spolehlivě neodstraní — Git nezapomíná.\n>\n> **Podáním nevzniká dossier ani autorizace, ani publikované tvrzení.** Rozsah pokrytí reálných osob určuje výhradně vlastník projektu záznamem v [append-only autorizačním logu](https://github.com/korczis/vomaste.cz/blob/master/AGENTS.md). Podnět je vstup k posouzení, ne slib výsledku — a to i v případě, že bude nakonec převzat beze změny.\n\n„Je to zajímavé\" ani „už to někde vyšlo\" samo o sobě nestačí — návrh musí obstát v testu veřejného zájmu ([konstituce, § 7](https://github.com/korczis/vomaste.cz/blob/master/docs/constitution/OPEN_INTELLIGENCE_COMMONS.md)): jaká veřejná funkce, veřejné prostředky nebo institucionální odpovědnost je ve hře.\n\n### Typ podnětu\n\nNový dossier (nová osoba/subjekt)\n\n### Navržený subjekt\n\nJan Testovací, starosta obce Testov\n\n### Popis a kontext\n\nPodle zveřejněného zápisu ze zastupitelstva obce Testov ze dne 2026-05-01 schválil starosta Jan Testovací zakázku bez veřejné soutěže. (upřesněno po editaci issue.)\n\n### Veřejný zájem\n\nJan Testovací je veřejně volený starosta obce Testov, jedná se o nakládání s veřejnými prostředky.\n\n### Zdrojové odkazy\n\nhttps://www.testov.cz/zapisy/2026-05-01.pdf\n\n### Identifikátory (nepovinné)\n\n_No response_\n\n### Co zatím nevíme (nepovinné)\n\nNení jasné, zda zakázka podléhala povinnosti veřejné soutěže.\n\n### Souvislost s existujícím dossierem (nepovinné)\n\n_No response_\n\n### Potvrzení\n\n- [x] Rozumím, že jde o veřejný GitHub issue a podnět bude veřejně viditelný.\n- [x] Nenahraji sem důvěrný materiál, citlivé důkazy ani údaje identifikující zdroj.\n- [x] Rozumím, že se nejedná o automatickou autorizaci ani publikaci — podnět jen čeká na posouzení vlastníkem.\n",
    "html_url": "https://github.com/korczis/vomaste.cz/issues/209",
    "state": "open",
    "author_login": "example-user",
    "created_at": "2026-08-01T09:00:00Z",
    "updated_at": "2026-08-02T10:00:00Z",
    "labels": [
      "navrh-rozsahu"
    ]
  },
  "event": {
    "action": "edited",
    "delivery_id": "fixture-e2e-209"
  }
}
